
Welcome to the MySQL monitor.  Commands end with ; or \g.
Your MySQL connection id is 9
Server version: 8.3.0 MySQL Community Server - GPL

Copyright (c) 2000, 2024, Oracle and/or its affiliates.

Oracle is a registered trademark of Oracle Corporation and/or its
affiliates. Other names may be trademarks of their respective
owners.

Type 'help;' or '\h' for help. Type '\c' to clear the current input statement.

mysql> create database VICTORINE;
Query OK, 1 row affected (0.02 sec)

mysql> USE VICTORINE;
Database changed

question1/


mysql> create table client_master(clientNO varchar(5),name varchar(10),address varchar(10),city varchar(10),state varchar(10),bal_due int(10));
Query OK, 0 rows affected, 1 warning (0.03 sec)

mysql> inset into client_master values ('A11','Adam','kk234','GASABO','KIGALI','600');
ERROR 1064 (42000): You have an error in your SQL syntax; check the manual that corresponds to your MySQL server version for the right syntax to use near 'inset into client_master values ('A11','Adam','kk234','GASABO','KIGALI','600')' at line 1
mysql> insert into client_master values ('A11','Adam','kk234','GASABO','KIGALI','600');
Query OK, 1 row affected (0.00 sec)

mysql> insert into client_master values ('B233','Sarah','kk456','kicukiro','KIGALI','7500');
Query OK, 1 row affected (0.00 sec)
mysql> insert into client_master values ('C123','Funny',HD233','HUYE','SOUTH','5000');
    '> insert into client_master values ('C123','Funny',HD233','HUYE','SOUTH','5000')
    -> insert into client_master values ('C123','Funny',HD233','HUY));
ERROR 1064 (42000): You have an error in your SQL syntax; check the manual that corresponds to your MySQL server version for the right syntax to use near '','HUYE','SOUTH','5000');
insert into client_master values ('C123','Funny',HD233' at line 1
mysql> insert into client_master values ('C123','Funny',HD233','HUYE','SOUTH','5000');
    '> insert into client_master values ('C123','Funny',HD233','HUYE','SOUTH','500
    '> insert into client_master values ('B233','Sarah','kk456','kicukiro','KIGALI','750
    -> insert into client_master values ('B233','Sarah','kk456','kicukiro','KIGALI',
    -> insert into client_master values ('B233','Sarah','kk456','kicukiro','KIGALI','7500');
ERROR 1064 (42000): You have an error in your SQL syntax; check the manual that corresponds to your MySQL server version for the right syntax to use near '','HUYE','SOUTH','5000');
insert into client_master values ('C123','Funny',HD233' at line 1
mysql> insert into client-master values('C123','Funny','HD233','huye','SOUTH','5000');
ERROR 1064 (42000): You have an error in your SQL syntax; check the manual that corresponds to your MySQL server version for the right syntax to use near '-master values('C123','Funny','HD233','huye','SOUTH','5000')' at line 1
mysql> insert into client-master values ('C123','Funny','HD233','huye','SOUTH','5000');
ERROR 1064 (42000): You have an error in your SQL syntax; check the manual that corresponds to your MySQL server version for the right syntax to use near '-master values ('C123','Funny','HD233','huye','SOUTH','5000')' at line 1
mysql> insert into client_master values ('C123','Funny','HD233','huye','SOUTH','5000');
Query OK, 1 row affected (0.00 sec)

mysql> insert into client_master values ('D123','GANNY','HG333','GATENGA','KIGALI','2500');
Query OK, 1 row affected (0.00 sec)

mysql> INSERT INTO CLIENT_MASTER VALUES ('E123',HAHH','KK454','KAYONZA','EAST','23342');
    '> insert into client_master values ('D123','GANNY','HG333','GATENGA','KIGALI','2500');
    '> insert into client_master values ('D123','GANNY','HG333','GATENGA','KIGALI','2500'
    '> INSERT INTO CLIENT_MASTER VALUES ('E123',HAHH','KK454','KAYONZA','EAST','23342');
ERROR 1064 (42000): You have an error in your SQL syntax; check the manual that corresponds to your MySQL server version for the right syntax to use near '','KK454','KAYONZA','EAST','23342');
insert into client_master values ('D123','G' at line 1
mysql> INSERT INTO CLIENT_MASTER VALUES ('E123','HAHH','KK454','KAYONZA','EAST','23342');
Query OK, 1 row affected (0.00 sec)

mysql> SELECT* FROM CLIENT_MASTER;
+----------+-------+---------+----------+--------+---------+
| clientNO | name  | address | city     | state  | bal_due |
+----------+-------+---------+----------+--------+---------+
| A11      | Adam  | kk234   | GASABO   | KIGALI |     600 |
| B233     | Sarah | kk456   | kicukiro | KIGALI |    7500 |
| C123     | Funny | HD233   | huye     | SOUTH  |    5000 |
| D123     | GANNY | HG333   | GATENGA  | KIGALI |    2500 |
| E123     | HAHH  | KK454   | KAYONZA  | EAST   |   23342 |
+----------+-------+---------+----------+--------+---------+
5 rows in set (0.02 sec)


question2/

mysql> SELECT* name from client_master WHERE BAL_DUE>5000;
ERROR 1064 (42000): You have an error in your SQL syntax; check the manual that corresponds to your MySQL server version for the right syntax to use near 'name from client_master WHERE BAL_DUE>5000' at line 1
mysql> SELECT name from client_master WHERE BAL_DUE>5000;
+-------+
| name  |
+-------+
| Sarah |
| HAHH  |
+-------+
2 rows in set (0.01 sec)

mysql> SELECT BAL_DUE AS BALANCE FROM TABLE NAME;
ERROR 1064 (42000): You have an error in your SQL syntax; check the manual that corresponds to your MySQL server version for the right syntax to use near 'TABLE NAME' at line 1

question 5/

mysql> SELECT BAL_DUE AS BALANCE FROM CLIENT_MASTER;
+---------+
| BALANCE |
+---------+
|     600 |
|    7500 |
|    5000 |
|    2500 |
|   23342 |
+---------+
5 rows in set (0.01  sec)

question 6/


mysql> CREATE TABLE DEPARTMENTS (    DepartmentID INT PRIMARY KEY,    DepartmentName VARCHAR(100) NOT NULL,    Location VARCHAR(100),    ManagerID INT,    EstablishedDate DATE);
ERROR 1050 (42S01): Table 'departments' already exists
mysql> INSERT INTO DEPARTMENTS VALUES (1, 'Human Resources', 'GIKONDO', 101, '2015-06-01'),
    -> INSERT INTO DEPARTMENTS VALUES (1, 'Human Resources', 'GIKONDO', 101, '2015-06-01'),
    -> INSERT INTO DEPARTMENTS VALUES(1, 'Human Resources', 'New York', 101, '2015-06-01'),
    -> INSERT INTO DEPARTMENTS (DepartmentID, DepartmentName, Location, ManagerID, EstablishedDate)VALUES(1, 'Human Resources', 'New York', 101, '2015-06-01'),(2, 'Finance', 'London', 102, '2016-03-15'),(3, 'IT', 'San Francisco', 103, '2017-08-20'),(4, 'Marketing', 'Berlin', 104, '2018-11-10'),(5, 'Sales', 'Tokyo', 105, '2020-01-05');
ERROR 1064 (42000): You have an error in your SQL syntax; check the manual that corresponds to your MySQL server version for the right syntax to use near 'INSERT INTO DEPARTMENTS VALUES (1, 'Human Resources', 'GIKONDO', 101, '2015-06-0' at line 2
mysql> INSERT INTO DEPARTMENTS VALUES(1, 'Human Resources', 'New York', 101, '2015-06-01'),(2, 'Finance', 'London', 102, '2016-03-15'),(3, 'IT', 'San Francisco', 103, '2017-08-20'),(4, 'Marketing', 'Berlin', 104, '2018-11-10'),(5, 'Sales', 'Tokyo', 105, '2020-01-05');
ERROR 1062 (23000): Duplicate entry '1' for key 'departments.PRIMARY'
mysql> INSERT INTO DEPARTMENTS VALUES(1, 'Human Resources', 'New York', 101, '2015-06-01'),(2, 'Finance', 'London', 102, '2016-03-15'),(3, 'IT', 'San Francisco', 103, '2017-08-20'),(4, 'Marketing', 'Berlin', 104, '2018-11-10'),(5, 'Sales', 'Tokyo', 105, '2020-01-05');
ERROR 1062 (23000): Duplicate entry '1' for key 'departments.PRIMARY'
mysql> INSERT INTO DEPARTMENTS VALUES(10, 'Human Resources', 'New York', 101, '2015-06-01'),(20, 'Finance', 'London', 102, '2016-03-15'),(30, 'IT', 'San Francisco', 103, '2017-08-20'),(40, 'Marketing', 'Berlin', 104, '2018-11-10'),(50, 'Sales', 'Tokyo', 105, '2020-01-05');
Query OK, 5 rows affected (0.00 sec)
Records: 5  Duplicates: 0  Warnings: 0

mysql> SELECT*FROM DEPARTMENTS;
+--------------+-----------------+---------------+-----------+-----------------+
| DepartmentID | DepartmentName  | Location      | ManagerID | EstablishedDate |
+--------------+-----------------+---------------+-----------+-----------------+
|            1 | Human Resources | New York      |       101 | 2015-06-01      |
|            2 | Finance         | London        |       102 | 2016-03-15      |
|            3 | IT              | San Francisco |       103 | 2017-08-20      |
|            4 | Marketing       | Berlin        |       104 | 2018-11-10      |
|            5 | Sales           | Tokyo         |       105 | 2020-01-05      |
|           10 | Human Resources | New York      |       101 | 2015-06-01      |
|           20 | Finance         | London        |       102 | 2016-03-15      |
|           30 | IT              | San Francisco |       103 | 2017-08-20      |
|           40 | Marketing       | Berlin        |       104 | 2018-11-10      |
|           50 | Sales           | Tokyo         |       105 | 2020-01-05      |
+--------------+-----------------+---------------+-----------+-----------------+
10 rows in set (0.00 sec)

mysql> DELETE FROM TABLE DEPARTMENT WHERE DEPARTMENTID=10,20,30,40,50;
ERROR 1064 (42000): You have an error in your SQL syntax; check the manual that corresponds to your MySQL server version for the right syntax to use near 'TABLE DEPARTMENT WHERE DEPARTMENTID=10,20,30,40,50' at line 1
mysql> DELETE FROM TABLE DEPARTMENT WHERE DEPARTMENTID=10;
ERROR 1064 (42000): You have an error in your SQL syntax; check the manual that corresponds to your MySQL server version for the right syntax to use near 'TABLE DEPARTMENT WHERE DEPARTMENTID=10' at line 1
mysql> DELETE FROM DEPARTMENT WHERE DEPARTMENTID=10;
ERROR 1146 (42S02): Table 'xyz.department' doesn't exist
mysql> DELETE FROM DEPARTMENTS WHERE DEPARTMENTID=10,20,30,40,50;
ERROR 1064 (42000): You have an error in your SQL syntax; check the manual that corresponds to your MySQL server version for the right syntax to use near ',20,30,40,50' at line 1
mysql> DELETE FROM DEPARTMENTS WHERE DEPARTMENTID=10;
Query OK, 1 row affected (0.00 sec)

mysql> DELETE FROM DEPARTMENTS WHERE DEPARTMENTID=20;
Query OK, 1 row affected (0.00 sec)

mysql> DELETE FROM DEPARTMENTS WHERE DEPARTMENTID=30;
Query OK, 1 row affected (0.00 sec)

mysql> DELETE FROM DEPARTMENTS WHERE DEPARTMENTID=40;
Query OK, 1 row affected (0.00 sec)

mysql> DELETE FROM DEPARTMENTS WHERE DEPARTMENTID=50;
Query OK, 1 row affected (0.00 sec)

mysql> SELECT*FROM DEPARTMENTS;
+--------------+-----------------+---------------+-----------+-----------------+
| DepartmentID | DepartmentName  | Location      | ManagerID | EstablishedDate |
+--------------+-----------------+---------------+-----------+-----------------+
|            1 | Human Resources | New York      |       101 | 2015-06-01      |
|            2 | Finance         | London        |       102 | 2016-03-15      |
|            3 | IT              | San Francisco |       103 | 2017-08-20      |
|            4 | Marketing       | Berlin        |       104 | 2018-11-10      |
|            5 | Sales           | Tokyo         |       105 | 2020-01-05      |
+--------------+-----------------+---------------+-----------+-----------------+
5 rows in set (0.00 sec)

mysql> CREATE TABLE EMPLOYEES (    EmployeeID INT PRIMARY KEY,    FirstName VARCHAR(50) NOT NULL,    LastName VARCHAR(50) NOT NULL,    DepartmentID INT,    HireDate DATE,    Salary DECIMAL(10, 2),    FOREIGN KEY (DepartmentID) REFERENCES DEPARTMENTS(DepartmentID);
ERROR 1064 (42000): You have an error in your SQL syntax; check the manual that corresponds to your MySQL server version for the right syntax to use near '' at line 1
mysql> CREATE TABLE EMPLOYEES (    EmployeeID INT PRIMARY KEY,    FirstName VARCHAR(50) NOT NULL,    LastName VARCHAR(50) NOT NULL,    DepartmentID INT,    HireDate DATE,    Salary DECIMAL(10, 2));
ERROR 1050 (42S01): Table 'employees' already exists
mysql> ALTER TABLE EMPLOYEES ADD FOREIGN KEY(DEPARTMENTID) REFERENCES DEPARTMENTS(DEPARTMENTID);
Query OK, 5 rows affected (0.07 sec)
Records: 5  Duplicates: 0  Warnings: 0

mysql> INSERT INTO EMPLOYEES VALUES(201, 'Alice', 'Smith', 1, '2021-07-01', 55000.00),(202, 'Bob', 'Johnson', 2, '2020-05-10', 75000.00),(203, 'Carol', 'Taylor', 3, '2019-12-15', 68000.00),(204, 'David', 'Brown', 4, '2022-01-20', 60000.00),(205, 'Eve', 'Davis', 5, '2023-03-10', 72000.00);
ERROR 1062 (23000): Duplicate entry '201' for key 'employees.PRIMARY'
mysql> INSERT INTO EMPLOYEES VALUES(201, 'Alice', 'Smith', 1, '2021-07-01', 55000.00),(202, 'Bob', 'Johnson', 2, '2020-05-10', 75000.00),(203, 'Carol', 'Taylor', 3, '2019-12-15', 68000.00),(204, 'David', 'Brown', 4, '2022-01-20', 60000.00),(205, 'Eve', 'Davis', 5, '2023-03-10', 72000.00);
ERROR 1062 (23000): Duplicate entry '201' for key 'employees.PRIMARY'
mysql> SELECT*FROM EMPLOYEES;
+------------+-----------+----------+--------------+------------+----------+
| EmployeeID | FirstName | LastName | DepartmentID | HireDate   | Salary   |
+------------+-----------+----------+--------------+------------+----------+
|        201 | Alice     | Smith    |            1 | 2021-07-01 | 55000.00 |
|        202 | Bob       | Johnson  |            2 | 2020-05-10 | 75000.00 |
|        203 | Carol     | Taylor   |            3 | 2019-12-15 | 68000.00 |
|        204 | David     | Brown    |            4 | 2022-01-20 | 60000.00 |
|        205 | Eve       | Davis    |            5 | 2023-03-10 | 72000.00 |
+------------+-----------+----------+--------------+------------+----------+
5 rows in set (0.00 sec)

mysql> DESCRIBE EMPLOYEES;
+--------------+---------------+------+-----+---------+-------+
| Field        | Type          | Null | Key | Default | Extra |
+--------------+---------------+------+-----+---------+-------+
| EmployeeID   | int           | NO   | PRI | NULL    |       |
| FirstName    | varchar(50)   | NO   |     | NULL    |       |
| LastName     | varchar(50)   | NO   |     | NULL    |       |
| DepartmentID | int           | YES  | MUL | NULL    |       |
| HireDate     | date          | YES  |     | NULL    |       |
| Salary       | decimal(10,2) | YES  |     | NULL    |       |
+--------------+---------------+------+-----+---------+-------+
6 rows in set (0.00 sec)

mysql> DESCRIBE DEPARTMENTS;
+-----------------+--------------+------+-----+---------+-------+
| Field           | Type         | Null | Key | Default | Extra |
+-----------------+--------------+------+-----+---------+-------+
| DepartmentID    | int          | NO   | PRI | NULL    |       |
| DepartmentName  | varchar(100) | NO   |     | NULL    |       |
| Location        | varchar(100) | YES  |     | NULL    |       |
| ManagerID       | int          | YES  |     | NULL    |       |
| EstablishedDate | date         | YES  |     | NULL    |       |
+-----------------+--------------+------+-----+---------+-------+
5 rows in set (0.00 sec)

mysql> SELECT*FROM EMPLOYEES;
+------------+-----------+----------+--------------+------------+----------+
| EmployeeID | FirstName | LastName | DepartmentID | HireDate   | Salary   |
+------------+-----------+----------+--------------+------------+----------+
|        201 | Alice     | Smith    |            1 | 2021-07-01 | 55000.00 |
|        202 | Bob       | Johnson  |            2 | 2020-05-10 | 75000.00 |
|        203 | Carol     | Taylor   |            3 | 2019-12-15 | 68000.00 |
|        204 | David     | Brown    |            4 | 2022-01-20 | 60000.00 |
|        205 | Eve       | Davis    |            5 | 2023-03-10 | 72000.00 |
+------------+-----------+----------+--------------+------------+----------+
5 rows in set (0.00 sec)

mysql> SELECT*FROM DEPARTMENTS;
+--------------+-----------------+---------------+-----------+-----------------+
| DepartmentID | DepartmentName  | Location      | ManagerID | EstablishedDate |
+--------------+-----------------+---------------+-----------+-----------------+
|            1 | Human Resources | New York      |       101 | 2015-06-01      |
|            2 | Finance         | London        |       102 | 2016-03-15      |
|            3 | IT              | San Francisco |       103 | 2017-08-20      |
|            4 | Marketing       | Berlin        |       104 | 2018-11-10      |
|            5 | Sales           | Tokyo         |       105 | 2020-01-05      |
+--------------+-----------------+---------------+-----------+-----------------+
5 rows in set (0.00 sec)

mysql> SELECT  EMPLOYEES.FirstName AS EmployeeName,DEPARTMENTS.DepartmentName AS Department FROM EMPLOYEES LEFT JOIN DEPARTMENTS ON  EMPLOYEES.DepartmentID = DEPARTMENTS.DepartmentID;
+--------------+-----------------+
| EmployeeName | Department      |
+--------------+-----------------+
| Alice        | Human Resources |
| Bob          | Finance         |
| Carol        | IT              |
| David        | Marketing       |
| Eve          | Sales           |
+--------------+-----------------+
5 rows in set (0.00 sec)

mysql> SELECT EMPLOYEES.FirstName AS EmployeeName, DEPARTMENTS.DepartmentName AS Department FROM EMPLOYEES RIGHT JOIN DEPARTMENTS ON EMPLOYEES.DepartmentID = DEPARTMENTS.DepartmentID;
+--------------+-----------------+
| EmployeeName | Department      |
+--------------+-----------------+
| Alice        | Human Resources |
| Bob          | Finance         |
| Carol        | IT              |
| David        | Marketing       |
| Eve          | Sales           |
+--------------+-----------------+
5 rows in set (0.00 sec)

mysql> SELECT *FROM EMPLOYEES WHERE Salary > (SELECT AVG(Salary) FROM EMPLOYEES);
+------------+-----------+----------+--------------+------------+----------+
| EmployeeID | FirstName | LastName | DepartmentID | HireDate   | Salary   |
+------------+-----------+----------+--------------+------------+----------+
|        202 | Bob       | Johnson  |            2 | 2020-05-10 | 75000.00 |
|        203 | Carol     | Taylor   |            3 | 2019-12-15 | 68000.00 |
|        205 | Eve       | Davis    |            5 | 2023-03-10 | 72000.00 |
+------------+-----------+----------+--------------+------------+----------+
3 rows in set (0.00 sec)


QUESTION 7 /



mysql> CREATE TABLE STUDENTS (STUDENTID VARCHAR(5) PRIMARY KEY,FULLNAMES VARCHAR(25) NOT NULL,GENDER VARCHAR(6) NOT NULL,AGE INT(2) NOT NULL,DEPARTMENT VARCHAR(30) NOT NULL);
Query OK, 0 rows affected, 1 warning (0.02 sec)

1.
mysql> CREATE VIEW ListOfStudents AS SELECT *FROM STUDENTS;
Query OK, 0 rows affected (0.03 sec)

2.
mysql> CREATE VIEW ListOfGirls AS SELECT *FROM STUDENTS WHERE GENDER = 'Female';
Query OK, 0 rows affected (0.02 sec)

3.
mysql> CREATE VIEW ListOfBoys AS SELECT *FROM STUDENTS WHERE GENDER = 'Male';
Query OK, 0 rows affected (0.01 sec)

4.
mysql> INSERT INTO STUDENTS VALUES('S001', 'Alice Smith', 'Female', 22, 'Computer Science'),('S002', 'Bob Johnson', 'Male', 19, 'Mechanical Engineering'),('S003', 'Carol Taylor', 'Female', 21, 'Electrical Engineering'),('S004', 'David Brown', 'Male', 18, 'Civil Engineering'),('S005', 'Eve Davis', 'Female', 20, 'Information Technology');
Query OK, 5 rows affected (0.00 sec)
Records: 5  Duplicates: 0  Warnings: 0

mysql> SELECT*FROM STUDENTS;
+-----------+--------------+--------+-----+------------------------+
| STUDENTID | FULLNAMES    | GENDER | AGE | DEPARTMENT             |
+-----------+--------------+--------+-----+------------------------+
| S001      | Alice Smith  | Female |  22 | Computer Science       |
| S002      | Bob Johnson  | Male   |  19 | Mechanical Engineering |
| S003      | Carol Taylor | Female |  21 | Electrical Engineering |
| S004      | David Brown  | Male   |  18 | Civil Engineering      |
| S005      | Eve Davis    | Female |  20 | Information Technology |
+-----------+--------------+--------+-----+------------------------+
5 rows in set (0.00 sec)

5.

mysql> DELETE FROM STUDENTS WHERE AGE < 20;
Query OK, 2 rows affected (0.00 sec)

mysql> SELECT*FROM STUDENTS;
+-----------+--------------+--------+-----+------------------------+
| STUDENTID | FULLNAMES    | GENDER | AGE | DEPARTMENT             |
+-----------+--------------+--------+-----+------------------------+
| S001      | Alice Smith  | Female |  22 | Computer Science       |
| S003      | Carol Taylor | Female |  21 | Electrical Engineering |
| S005      | Eve Davis    | Female |  20 | Information Technology |
+-----------+--------------+--------+-----+------------------------+
3 rows in set (0.00 sec)


question 9/


mysql> CREATE DATABASE Company;
ERROR 1007 (HY000): Can't create database 'company'; database exists
mysql> USE Company;
Database changed
mysql>
mysql> -- Create the EMPLOYEES table with all necessary columns
Query OK, 0 rows affected (0.00 sec)

mysql> CREATE TABLE EMPLOYEES (
    ->     Employee_Id INT PRIMARY KEY,
    ->     First_Name VARCHAR(50) NOT NULL,
    ->     Last_Name VARCHAR(50) NOT NULL,
    ->     Email VARCHAR(100),
    ->     Phone_Number VARCHAR(15),
    ->     Hire_Date DATE,
    ->     Job_Id VARCHAR(10),
    ->     Salary DECIMAL(10, 2) NOT NULL,
    ->     Commission_Pct DECIMAL(5, 2),
    ->     Manager_Id INT,
    ->     Department_Id INT
    -> );
ERROR 1050 (42S01): Table 'employees' already exists
mysql> -- Insert sample data into the EMPLOYEES table
Query OK, 0 rows affected (0.00 sec)

mysql> INSERT INTO EMPLOYEES (Employee_Id, First_Name, Last_Name, Email, Phone_Number, Hire_Date, Job_Id, Salary, Commission_Pct, Manager_Id, Department_Id)
    -> VALUES
    ->     (101, 'John', 'Doe', 'john.doe@example.com', '555-1234', '2020-01-15', 'SA_REP', 5000.00, 0.10, NULL, 60),
    ->     (102, 'Jane', 'Smith', 'jane.smith@example.com', '555-5678', '2019-03-10', 'SA_REP', 6000.00, 0.12, 101, 60),
    ->     (103, 'Alice', 'Austin', 'alice.austin@example.com', '555-9876', '2021-06-21', 'SA_REP', 4800.00, 0.08, 101, 70),
    ->     (104, 'Michael', 'Austin', 'michael.austin@example.com', '555-6543', '2020-11-01', 'IT_PROG', 7000.00, NULL, 102, 70),
    ->     (105, 'Emily', 'Davis', 'emily.davis@example.com', '555-1122', '2022-05-15', 'FI_ACCOUNT', 4500.00, NULL, 102, 80),
    ->     (106, 'Robert', 'Johnson', 'robert.johnson@example.com', '555-3344', '2018-09-03', 'SA_REP', 5200.00, 0.09, 103, 80),
    ->     (107, 'Patricia', 'Williams', 'patricia.williams@example.com', '555-7788', '2017-12-19', 'SA_REP', 6300.00, 0.10, 103, 80),
    ->     (108, 'David', 'Miller', 'david.miller@example.com', '555-5566', '2022-02-18', 'MK_MAN', 4800.00, NULL, 104, 90),
    ->     (109, 'Susan', 'Wilson', 'susan.wilson@example.com', '555-7789', '2020-06-25', 'IT_PROG', 7200.00, NULL, 104, 90),
    ->     (110, 'James', 'Taylor', 'james.taylor@example.com', '555-9900', '2021-08-30', 'SA_REP', 5800.00, 0.11, 104, 90);
ERROR 1054 (42S22): Unknown column 'Email' in 'field list'
mysql> SELECT Employee_Id, First_Name, Last_Name, Salary
    -> FROM EMPLOYEES;
+-------------+------------+-----------+----------+
| Employee_Id | First_Name | Last_Name | Salary   |
+-------------+------------+-----------+----------+
|         101 | John       | Doe       | 50000.00 |
|         102 | Jane       | Smith     | 60000.00 |
|         103 | Alice      | Brown     | 55000.00 |
|         104 | Michael    | White     | 70000.00 |
|         105 | Emily      | Davis     | 45000.00 |
|         106 | Robert     | Johnson   | 52000.00 |
|         107 | Patricia   | Williams  | 63000.00 |
|         108 | David      | Miller    | 48000.00 |
|         109 | Susan      | Wilson    | 72000.00 |
|         110 | James      | Taylor    | 58000.00 |
+-------------+------------+-----------+----------+
10 rows in set (0.00 sec)

mysql> SELECT Employee_Id, First_Name, Last_Name
    -> FROM EMPLOYEES
    -> WHERE Manager_Id = 100;
Empty set (0.00 sec)

mysql> SELECT First_Name, Last_Name
    -> FROM EMPLOYEES
    -> WHERE Salary >= 4800;
+------------+-----------+
| First_Name | Last_Name |
+------------+-----------+
| John       | Doe       |
| Jane       | Smith     |
| Alice      | Brown     |
| Michael    | White     |
| Emily      | Davis     |
| Robert     | Johnson   |
| Patricia   | Williams  |
| David      | Miller    |
| Susan      | Wilson    |
| James      | Taylor    |
+------------+-----------+
10 rows in set (0.00 sec)

mysql> SELECT First_Name, Last_Name
    -> FROM EMPLOYEES
    -> WHERE Last_Name = 'AUSTIN';
Empty set (0.00 sec)

mysql> SELECT First_Name, Last_Name
    -> FROM EMPLOYEES
    -> WHERE Department_Id IN (60, 70, 80);
ERROR 1054 (42S22): Unknown column 'Department_Id' in 'where clause'
mysql> DESCRIBE EMPLOYEES;
+-------------+---------------+------+-----+---------+-------+
| Field       | Type          | Null | Key | Default | Extra |
+-------------+---------------+------+-----+---------+-------+
| Employee_Id | int           | NO   | PRI | NULL    |       |
| First_Name  | varchar(50)   | NO   |     | NULL    |       |
| Last_Name   | varchar(50)   | NO   |     | NULL    |       |
| Salary      | decimal(10,2) | NO   |     | NULL    |       |
| Manager_Id  | int           | YES  |     | NULL    |       |
+-------------+---------------+------+-----+---------+-------+
5 rows in set (0.00 sec)

mysql> ALTER TABLE EMPLOYEES ADD COLUMN Department_Id INT;
Query OK, 10 rows affected (0.04 sec)
Records: 10  Duplicates: 0  Warnings: 0

mysql> SELECT First_Name, Last_Name
    -> FROM EMPLOYEES
    -> WHERE Department_Id IN (60, 70, 80);
Empty set (0.00 sec)



question 10/


mysql> CREATE TABLE Sales (
    ->     Sales_No INT PRIMARY KEY,
    ->     Salesname VARCHAR(50) NOT NULL,
    ->     Branch VARCHAR(50) NOT NULL,
    ->     Salesamount DECIMAL(10, 2) NOT NULL,
    ->     DOB DATE NOT NULL
    -> );
Query OK, 0 rows affected (0.02 sec)

mysql> INSERT INTO Sales (Sales_No, Salesname, Branch, Salesamount, DOB)
    -> VALUES
    ->     (1, 'John Doe', 'Kigali', 5000.00, '1985-12-15'),
    ->     (2, 'Jane Smith', 'Huye', 6000.00, '1990-03-10'),
    ->     (3, 'Alice Brown', 'Kigali', 4500.00, '1982-12-25'),
    ->     (4, 'Michael White', 'Musanze', 7000.00, '1995-12-05'),
    ->     (5, 'Emily Davis', 'Kigali', 3000.00, '1992-11-17');
Query OK, 5 rows affected (0.00 sec)
Records: 5  Duplicates: 0  Warnings: 0

mysql> SELECT Branch, SUM(Salesamount) AS Total_Salesamount
    -> FROM Sales
    -> GROUP BY Branch;
+---------+-------------------+
| Branch  | Total_Salesamount |
+---------+-------------------+
| Kigali  |          12500.00 |
| Huye    |           6000.00 |
| Musanze |           7000.00 |
+---------+-------------------+
3 rows in set (0.00 sec)

mysql> SELECT Branch, AVG(Salesamount) AS Average_Salesamount
    -> FROM Sales
    -> GROUP BY Branch;
+---------+---------------------+
| Branch  | Average_Salesamount |
+---------+---------------------+
| Kigali  |         4166.666667 |
| Huye    |         6000.000000 |
| Musanze |         7000.000000 |
+---------+---------------------+
3 rows in set (0.00 sec)

mysql> SELECT Salesname, DATE_FORMAT(DOB, '%d-%b-%y') AS DOB
    -> FROM Sales
    -> WHERE MONTH(DOB) = 12;
+---------------+-----------+
| Salesname     | DOB       |
+---------------+-----------+
| John Doe      | 15-Dec-85 |
| Alice Brown   | 25-Dec-82 |
| Michael White | 05-Dec-95 |
+---------------+-----------+
3 rows in set (0.00 sec)

mysql> SELECT Salesname, DATE_FORMAT(DOB, '%b-%d-%Y') AS DOB
    -> FROM Sales
    -> ORDER BY MONTH(DOB), DAY(DOB);
+---------------+-------------+
| Salesname     | DOB         |
+---------------+-------------+
| Jane Smith    | Mar-10-1990 |
| Emily Davis   | Nov-17-1992 |
| Michael White | Dec-05-1995 |
| John Doe      | Dec-15-1985 |
| Alice Brown   | Dec-25-1982 |
+---------------+-------------+
5 rows in set (0.00 sec)

mysql>                                                                               
    
